,date,teams,home_team,away_team,opposition,result,score,home_goals,away_goals,aggregrate_score,peanalties,competition,season,year,month,day,swansea_goal,opposition_goals
2600,11 Apr 1998,Rotherham United v Swansea City,Rotherham United,Swansea City,Rotherham United,D,1-1,1,1,-,-,League Division 3,1997,1998,4,11,1,1
2601,13 Apr 1998,Swansea City v Rochdale,Swansea City,Rochdale,Rochdale,W,3-0,3,0,-,-,League Division 3,1997,1998,4,13,3,0
2602,18 Apr 1998,Cambridge United v Swansea City,Cambridge United,Swansea City,Cambridge United,L,4-1,4,1,-,-,League Division 3,1997,1998,4,18,1,4
2603,25 Apr 1998,Swansea City v Doncaster Rovers,Swansea City,Doncaster Rovers,Doncaster Rovers,D,0-0,0,0,-,-,League Division 3,1997,1998,4,25,0,0
2604,02 May 1998,Mansfield Town v Swansea City,Mansfield Town,Swansea City,Mansfield Town,L,1-0,1,0,-,-,League Division 3,1997,1998,5,2,0,1
2605,08 Aug 1998,Swansea City v Exeter City,Swansea City,Exeter City,Exeter City,W,2-0,2,0,-,-,League Division 3,1998,1998,8,8,2,0
2606,11 Aug 1998,Swansea City v Norwich City,Swansea City,Norwich City,Norwich City,D,1-1,1,1,-,-,League Cup,1998,1998,8,11,1,1
2607,15 Aug 1998,Cambridge United v Swansea City,Cambridge United,Swansea City,Cambridge United,L,2-1,2,1,-,-,League Division 3,1998,1998,8,15,1,2
2608,18 Aug 1998,Norwich City v Swansea City,Norwich City,Swansea City,Norwich City,L,1-0,1,0, 2-1,-,League Cup,1998,1998,8,18,0,1
2609,22 Aug 1998,Swansea City v Leyton Orient,Swansea City,Leyton Orient,Leyton Orient,D,1-1,1,1,-,-,League Division 3,1998,1998,8,22,1,1
2610,29 Aug 1998,Mansfield Town v Swansea City,Mansfield Town,Swansea City,Mansfield Town,L,1-0,1,0,-,-,League Division 3,1998,1998,8,29,0,1
2611,31 Aug 1998,Swansea City v Scunthorpe United,Swansea City,Scunthorpe United,Scunthorpe United,L,1-2,1,2,-,-,League Division 3,1998,1998,8,31,1,2
2612,05 Sep 1998,Brighton and Hove Albion v Swansea City,Brighton and Hove Albion,Swansea City,Brighton and Hove Albion,L,1-0,1,0,-,-,League Division 3,1998,1998,9,5,0,1
2613,08 Sep 1998,Carlisle United v Swansea City,Carlisle United,Swansea City,Carlisle United,W,1-2,1,2,-,-,League Division 3,1998,1998,9,8,2,1
2614,12 Sep 1998,Swansea City v Scarborough,Swansea City,Scarborough,Scarborough,W,2-0,2,0,-,-,League Division 3,1998,1998,9,12,2,0
2615,19 Sep 1998,Torquay United v Swansea City,Torquay United,Swansea City,Torquay United,D,1-1,1,1,-,-,League Division 3,1998,1998,9,19,1,1
2616,26 Sep 1998,Swansea City v Southend United,Swansea City,Southend United,Southend United,W,3-1,3,1,-,-,League Division 3,1998,1998,9,26,3,1
2617,03 Oct 1998,Darlington v Swansea City,Darlington,Swansea City,Darlington,D,2-2,2,2,-,-,League Division 3,1998,1998,10,3,2,2
2618,09 Oct 1998,Swansea City v Rotherham United,Swansea City,Rotherham United,Rotherham United,D,1-1,1,1,-,-,League Division 3,1998,1998,10,9,1,1
2619,17 Oct 1998,Chester City v Swansea City,Chester City,Swansea City,Chester City,D,1-1,1,1,-,-,League Division 3,1998,1998,10,17,1,1
2620,20 Oct 1998,Shrewsbury Town v Swansea City,Shrewsbury Town,Swansea City,Shrewsbury Town,L,1-0,1,0,-,-,League Division 3,1998,1998,10,20,0,1
2621,31 Oct 1998,Halifax Town v Swansea City,Halifax Town,Swansea City,Halifax Town,L,2-0,2,0,-,-,League Division 3,1998,1998,10,31,0,2
2622,07 Nov 1998,Swansea City v Peterborough United,Swansea City,Peterborough United,Peterborough United,D,0-0,0,0,-,-,League Division 3,1998,1998,11,7,0,0
2623,10 Nov 1998,Plymouth Argyle v Swansea City,Plymouth Argyle,Swansea City,Plymouth Argyle,W,1-2,1,2,-,-,League Division 3,1998,1998,11,10,2,1
2624,13 Nov 1998,Swansea City v Millwall,Swansea City,Millwall,Millwall,W,3-0,3,0,-,-,FA Cup,1998,1998,11,13,3,0
2625,22 Nov 1998,Swansea City v Cardiff City,Swansea City,Cardiff City,Cardiff City,W,2-1,2,1,-,-,League Division 3,1998,1998,11,22,2,1
2626,28 Nov 1998,Hartlepool United v Swansea City,Hartlepool United,Swansea City,Hartlepool United,W,1-2,1,2,-,-,League Division 3,1998,1998,11,28,2,1
2627,05 Dec 1998,Swansea City v Stoke City,Swansea City,Stoke City,Stoke City,W,1-0,1,0,-,-,FA Cup,1998,1998,12,5,1,0
2628,08 Dec 1998,Swansea City v Barnet,Swansea City,Barnet,Barnet,W,4-1,4,1,-,-,Auto Windscreens Shield,1998,1998,12,8,4,1
2629,12 Dec 1998,Swansea City v Rochdale,Swansea City,Rochdale,Rochdale,D,1-1,1,1,-,-,League Division 3,1998,1998,12,12,1,1
2630,19 Dec 1998,Hull City v Swansea City,Hull City,Swansea City,Hull City,W,0-2,0,2,-,-,League Division 3,1998,1998,12,19,2,0
2631,26 Dec 1998,Leyton Orient v Swansea City,Leyton Orient,Swansea City,Leyton Orient,D,1-1,1,1,-,-,League Division 3,1998,1998,12,26,1,1
2632,28 Dec 1998,Swansea City v Barnet,Swansea City,Barnet,Barnet,W,2-1,2,1,-,-,League Division 3,1998,1998,12,28,2,1
2633,02 Jan 1999,West Ham United v Swansea City,West Ham United,Swansea City,West Ham United,D,1-1,1,1,-,-,FA Cup,1998,1999,1,2,1,1
2634,05 Jan 1999,Swansea City v Gillingham,Swansea City,Gillingham,Gillingham,L,0-1,0,1,-,-,Auto Windscreens Shield,1998,1999,1,5,0,1
2635,09 Jan 1999,Exeter City v Swansea City,Exeter City,Swansea City,Exeter City,L,4-0,4,0,-,-,League Division 3,1998,1999,1,9,0,4
2636,13 Jan 1999,Swansea City v West Ham United,Swansea City,West Ham United,West Ham United,W,1-0,1,0,-,-,FA Cup,1998,1999,1,13,1,0
2637,23 Jan 1999,Swansea City v Derby County,Swansea City,Derby County,Derby County,L,0-1,0,1,-,-,FA Cup,1998,1999,1,23,0,1
2638,30 Jan 1999,Barnet v Swansea City,Barnet,Swansea City,Barnet,W,0-1,0,1,-,-,League Division 3,1998,1999,1,30,1,0
2639,05 Feb 1999,Swansea City v Brighton and Hove Albion,Swansea City,Brighton and Hove Albion,Brighton and Hove Albion,D,2-2,2,2,-,-,League Division 3,1998,1999,2,5,2,2
2640,13 Feb 1999,Swansea City v Carlisle United,Swansea City,Carlisle United,Carlisle United,D,1-1,1,1,-,-,League Division 3,1998,1999,2,13,1,1
2641,16 Feb 1999,Swansea City v Brentford,Swansea City,Brentford,Brentford,W,2-1,2,1,-,-,League Division 3,1998,1999,2,16,2,1
2642,20 Feb 1999,Scarborough v Swansea City,Scarborough,Swansea City,Scarborough,L,2-1,2,1,-,-,League Division 3,1998,1999,2,20,1,2
2643,23 Feb 1999,Swansea City v Mansfield Town,Swansea City,Mansfield Town,Mansfield Town,W,1-0,1,0,-,-,League Division 3,1998,1999,2,23,1,0
2644,27 Feb 1999,Swansea City v Torquay United,Swansea City,Torquay United,Torquay United,D,0-0,0,0,-,-,League Division 3,1998,1999,2,27,0,0
2645,06 Mar 1999,Southend United v Swansea City,Southend United,Swansea City,Southend United,L,2-0,2,0,-,-,League Division 3,1998,1999,3,6,0,2
2646,09 Mar 1999,Swansea City v Darlington,Swansea City,Darlington,Darlington,W,2-0,2,0,-,-,League Division 3,1998,1999,3,9,2,0
2647,13 Mar 1999,Peterborough United v Swansea City,Peterborough United,Swansea City,Peterborough United,W,0-1,0,1,-,-,League Division 3,1998,1999,3,13,1,0
2648,20 Mar 1999,Swansea City v Halifax Town,Swansea City,Halifax Town,Halifax Town,L,1-2,1,2,-,-,League Division 3,1998,1999,3,20,1,2
2649,23 Mar 1999,Scunthorpe United v Swansea City,Scunthorpe United,Swansea City,Scunthorpe United,W,1-2,1,2,-,-,League Division 3,1998,1999,3,23,2,1
2650,03 Apr 1999,Swansea City v Chester City,Swansea City,Chester City,Chester City,D,1-1,1,1,-,-,League Division 3,1998,1999,4,3,1,1
2651,05 Apr 1999,Rotherham United v Swansea City,Rotherham United,Swansea City,Rotherham United,L,1-0,1,0,-,-,League Division 3,1998,1999,4,5,0,1
2652,09 Apr 1999,Swansea City v Shrewsbury Town,Swansea City,Shrewsbury Town,Shrewsbury Town,D,1-1,1,1,-,-,League Division 3,1998,1999,4,9,1,1
2653,13 Apr 1999,Swansea City v Hartlepool United,Swansea City,Hartlepool United,Hartlepool United,W,1-0,1,0,-,-,League Division 3,1998,1999,4,13,1,0
2654,18 Apr 1999,Cardiff City v Swansea City,Cardiff City,Swansea City,Cardiff City,D,0-0,0,0,-,-,League Division 3,1998,1999,4,18,0,0
2655,24 Apr 1999,Swansea City v Plymouth Argyle,Swansea City,Plymouth Argyle,Plymouth Argyle,L,2-3,2,3,-,-,League Division 3,1998,1999,4,24,2,3
2656,01 May 1999,Rochdale v Swansea City,Rochdale,Swansea City,Rochdale,W,0-3,0,3,-,-,League Division 3,1998,1999,5,1,3,0
2657,04 May 1999,Brentford v Swansea City,Brentford,Swansea City,Brentford,L,4-1,4,1,-,-,League Division 3,1998,1999,5,4,1,4
2658,06 May 1999,Swansea City v Cambridge United,Swansea City,Cambridge United,Cambridge United,W,2-0,2,0,-,-,League Division 3,1998,1999,5,6,2,0
2659,08 May 1999,Swansea City v Hull City,Swansea City,Hull City,Hull City,W,2-0,2,0,-,-,League Division 3,1998,1999,5,8,2,0
2660,16 May 1999,Swansea City v Scunthorpe United,Swansea City,Scunthorpe United,Scunthorpe United,W,1-0,1,0,-,-,League Division 3 Play-Offs,1998,1999,5,16,1,0
2661,19 May 1999,Scunthorpe United v Swansea City,Scunthorpe United,Swansea City,Scunthorpe United,L,3-1,3,1, 3-2,-,League Division 3 Play-Offs,1998,1999,5,19,1,3
2662,07 Aug 1999,York City v Swansea City,York City,Swansea City,York City,L,1-0,1,0,-,-,League Division 3,1999,1999,8,7,0,1
2663,11 Aug 1999,Swansea City v Millwall,Swansea City,Millwall,Millwall,W,2-0,2,0,-,-,League Cup,1999,1999,8,11,2,0
2664,14 Aug 1999,Swansea City v Carlisle United,Swansea City,Carlisle United,Carlisle United,W,1-0,1,0,-,-,League Division 3,1999,1999,8,14,1,0
2665,21 Aug 1999,Macclesfield Town v Swansea City,Macclesfield Town,Swansea City,Macclesfield Town,W,1-2,1,2,-,-,League Division 3,1999,1999,8,21,2,1
2666,24 Aug 1999,Millwall v Swansea City,Millwall,Swansea City,Millwall,D,1-1,1,1, 1-3,-,League Cup,1999,1999,8,24,1,1
2667,28 Aug 1999,Swansea City v Southend United,Swansea City,Southend United,Southend United,W,3-1,3,1,-,-,League Division 3,1999,1999,8,28,3,1
2668,30 Aug 1999,Lincoln City v Swansea City,Lincoln City,Swansea City,Lincoln City,W,0-1,0,1,-,-,League Division 3,1999,1999,8,30,1,0
2669,11 Sep 1999,Swansea City v Barnet,Swansea City,Barnet,Barnet,L,1-2,1,2,-,-,League Division 3,1999,1999,9,11,1,2
2670,14 Sep 1999,Swansea City v Derby County,Swansea City,Derby County,Derby County,D,0-0,0,0,-,-,League Cup,1999,1999,9,14,0,0
2671,18 Sep 1999,Hull City v Swansea City,Hull City,Swansea City,Hull City,L,2-0,2,0,-,-,League Division 3,1999,1999,9,18,0,2
2672,22 Sep 1999,Derby County v Swansea City,Derby County,Swansea City,Derby County,L,3-1,3,1, 3-1,-,League Cup,1999,1999,9,22,1,3
2673,25 Sep 1999,Rochdale v Swansea City,Rochdale,Swansea City,Rochdale,D,0-0,0,0,-,-,League Division 3,1999,1999,9,25,0,0
2674,02 Oct 1999,Swansea City v Mansfield Town,Swansea City,Mansfield Town,Mansfield Town,L,0-1,0,1,-,-,League Division 3,1999,1999,10,2,0,1
2675,12 Oct 1999,Swansea City v Rotherham United,Swansea City,Rotherham United,Rotherham United,W,2-0,2,0,-,-,League Division 3,1999,1999,10,12,2,0
2676,16 Oct 1999,Torquay United v Swansea City,Torquay United,Swansea City,Torquay United,L,1-0,1,0,-,-,League Division 3,1999,1999,10,16,0,1
2677,19 Oct 1999,Exeter City v Swansea City,Exeter City,Swansea City,Exeter City,D,1-1,1,1,-,-,League Division 3,1999,1999,10,19,1,1
2678,22 Oct 1999,Swansea City v Rochdale,Swansea City,Rochdale,Rochdale,W,1-0,1,0,-,-,League Division 3,1999,1999,10,22,1,0
2679,30 Oct 1999,Swansea City v Colchester United,Swansea City,Colchester United,Colchester United,W,2-1,2,1,-,-,FA Cup,1999,1999,10,30,2,1
2680,02 Nov 1999,Northampton Town v Swansea City,Northampton Town,Swansea City,Northampton Town,L,2-1,2,1,-,-,League Division 3,1999,1999,11,2,1,2
2681,05 Nov 1999,Swansea City v Halifax Town,Swansea City,Halifax Town,Halifax Town,W,3-1,3,1,-,-,League Division 3,1999,1999,11,5,3,1
2682,12 Nov 1999,Shrewsbury Town v Swansea City,Shrewsbury Town,Swansea City,Shrewsbury Town,D,1-1,1,1,-,-,League Division 3,1999,1999,11,12,1,1
2683,16 Nov 1999,Swansea City v Cheltenham Town,Swansea City,Cheltenham Town,Cheltenham Town,D,0-0,0,0,-,-,League Division 3,1999,1999,11,16,0,0
2684,20 Nov 1999,Oldham Athletic v Swansea City,Oldham Athletic,Swansea City,Oldham Athletic,L,1-0,1,0,-,-,FA Cup,1999,1999,11,20,0,1
2685,23 Nov 1999,Swansea City v Darlington,Swansea City,Darlington,Darlington,D,0-0,0,0,-,-,League Division 3,1999,1999,11,23,0,0
2686,27 Nov 1999,Chester City v Swansea City,Chester City,Swansea City,Chester City,W,0-1,0,1,-,-,League Division 3,1999,1999,11,27,1,0
2687,04 Dec 1999,Swansea City v York City,Swansea City,York City,York City,W,1-0,1,0,-,-,League Division 3,1999,1999,12,4,1,0
2688,07 Dec 1999,Swansea City v Colchester United,Swansea City,Colchester United,Colchester United,W,3-1,3,1,-,-,Auto Windscreens Shield,1999,1999,12,7,3,1
2689,11 Dec 1999,Hartlepool United v Swansea City,Hartlepool United,Swansea City,Hartlepool United,W,0-1,0,1,-,-,League Division 3,1999,1999,12,11,1,0
2690,18 Dec 1999,Swansea City v Brighton and Hove Albion,Swansea City,Brighton and Hove Albion,Brighton and Hove Albion,W,2-0,2,0,-,-,League Division 3,1999,1999,12,18,2,0
2691,26 Dec 1999,Leyton Orient v Swansea City,Leyton Orient,Swansea City,Leyton Orient,W,0-1,0,1,-,-,League Division 3,1999,1999,12,26,1,0
2692,28 Dec 1999,Swansea City v Plymouth Argyle,Swansea City,Plymouth Argyle,Plymouth Argyle,W,1-0,1,0,-,-,League Division 3,1999,1999,12,28,1,0
2693,03 Jan 2000,Peterborough United v Swansea City,Peterborough United,Swansea City,Peterborough United,W,2-3,2,3,-,-,League Division 3,1999,2000,1,3,3,2
2694,08 Jan 2000,Swansea City v Hartlepool United,Swansea City,Hartlepool United,Hartlepool United,W,2-1,2,1,-,-,League Division 3,1999,2000,1,8,2,1
2695,11 Jan 2000,Exeter City v Swansea City,Exeter City,Swansea City,Exeter City,L,2-0,2,0,-,-,Auto Windscreens Shield,1999,2000,1,11,0,2
2696,22 Jan 2000,Swansea City v Macclesfield Town,Swansea City,Macclesfield Town,Macclesfield Town,W,1-0,1,0,-,-,League Division 3,1999,2000,1,22,1,0
2697,29 Jan 2000,Southend United v Swansea City,Southend United,Swansea City,Southend United,L,2-1,2,1,-,-,League Division 3,1999,2000,1,29,1,2
2698,04 Feb 2000,Swansea City v Lincoln City,Swansea City,Lincoln City,Lincoln City,W,2-1,2,1,-,-,League Division 3,1999,2000,2,4,2,1
2699,13 Feb 2000,Cheltenham Town v Swansea City,Cheltenham Town,Swansea City,Cheltenham Town,D,0-0,0,0,-,-,League Division 3,1999,2000,2,13,0,0
2700,18 Feb 2000,Swansea City v Chester City,Swansea City,Chester City,Chester City,W,2-1,2,1,-,-,League Division 3,1999,2000,2,18,2,1
2701,26 Feb 2000,Swansea City v Hull City,Swansea City,Hull City,Hull City,D,0-0,0,0,-,-,League Division 3,1999,2000,2,26,0,0
2702,04 Mar 2000,Barnet v Swansea City,Barnet,Swansea City,Barnet,W,0-1,0,1,-,-,League Division 3,1999,2000,3,4,1,0
2703,07 Mar 2000,Halifax Town v Swansea City,Halifax Town,Swansea City,Halifax Town,W,0-1,0,1,-,-,League Division 3,1999,2000,3,7,1,0
2704,10 Mar 2000,Swansea City v Northampton Town,Swansea City,Northampton Town,Northampton Town,W,4-1,4,1,-,-,League Division 3,1999,2000,3,10,4,1
2705,18 Mar 2000,Darlington v Swansea City,Darlington,Swansea City,Darlington,D,1-1,1,1,-,-,League Division 3,1999,2000,3,18,1,1
2706,21 Mar 2000,Swansea City v Shrewsbury Town,Swansea City,Shrewsbury Town,Shrewsbury Town,D,1-1,1,1,-,-,League Division 3,1999,2000,3,21,1,1
2707,25 Mar 2000,Swansea City v Leyton Orient,Swansea City,Leyton Orient,Leyton Orient,D,0-0,0,0,-,-,League Division 3,1999,2000,3,25,0,0
2708,28 Mar 2000,Carlisle United v Swansea City,Carlisle United,Swansea City,Carlisle United,L,2-0,2,0,-,-,League Division 3,1999,2000,3,28,0,2
2709,01 Apr 2000,Brighton and Hove Albion v Swansea City,Brighton and Hove Albion,Swansea City,Brighton and Hove Albion,D,1-1,1,1,-,-,League Division 3,1999,2000,4,1,1,1
2710,08 Apr 2000,Swansea City v Peterborough United,Swansea City,Peterborough United,Peterborough United,D,0-0,0,0,-,-,League Division 3,1999,2000,4,8,0,0
2711,15 Apr 2000,Plymouth Argyle v Swansea City,Plymouth Argyle,Swansea City,Plymouth Argyle,L,1-0,1,0,-,-,League Division 3,1999,2000,4,15,0,1
2712,22 Apr 2000,Swansea City v Torquay United,Swansea City,Torquay United,Torquay United,W,2-1,2,1,-,-,League Division 3,1999,2000,4,22,2,1
2713,24 Apr 2000,Mansfield Town v Swansea City,Mansfield Town,Swansea City,Mansfield Town,W,0-1,0,1,-,-,League Division 3,1999,2000,4,24,1,0
2714,29 Apr 2000,Swansea City v Exeter City,Swansea City,Exeter City,Exeter City,W,3-0,3,0,-,-,League Division 3,1999,2000,4,29,3,0
2715,06 May 2000,Rotherham United v Swansea City,Rotherham United,Swansea City,Rotherham United,D,1-1,1,1,-,-,League Division 3,1999,2000,5,6,1,1
2716,12 Aug 2000,Swansea City v Wigan Athletic,Swansea City,Wigan Athletic,Wigan Athletic,D,0-0,0,0,-,-,League Division 2,2000,2000,8,12,0,0
2717,19 Aug 2000,Brentford v Swansea City,Brentford,Swansea City,Brentford,D,0-0,0,0,-,-,League Division 2,2000,2000,8,19,0,0
2718,22 Aug 2000,Swansea City v West Bromwich Albion,Swansea City,West Bromwich Albion,West Bromwich Albion,D,0-0,0,0,-,-,League Cup,2000,2000,8,22,0,0
2719,26 Aug 2000,Swansea City v Colchester United,Swansea City,Colchester United,Colchester United,L,0-2,0,2,-,-,League Division 2,2000,2000,8,26,0,2
2720,28 Aug 2000,Peterborough United v Swansea City,Peterborough United,Swansea City,Peterborough United,W,0-2,0,2,-,-,League Division 2,2000,2000,8,28,2,0
2721,06 Sep 2000,West Bromwich Albion v Swansea City,West Bromwich Albion,Swansea City,West Bromwich Albion,L,2-1,2,1, 2-1,-,League Cup,2000,2000,9,6,1,2
2722,09 Sep 2000,Millwall v Swansea City,Millwall,Swansea City,Millwall,L,1-0,1,0,-,-,League Division 2,2000,2000,9,9,0,1
2723,12 Sep 2000,Notts County v Swansea City,Notts County,Swansea City,Notts County,W,0-1,0,1,-,-,League Division 2,2000,2000,9,12,1,0
2724,16 Sep 2000,Swansea City v Luton Town,Swansea City,Luton Town,Luton Town,W,4-0,4,0,-,-,League Division 2,2000,2000,9,16,4,0
2725,23 Sep 2000,Reading v Swansea City,Reading,Swansea City,Reading,L,5-1,5,1,-,-,League Division 2,2000,2000,9,23,1,5
2726,30 Sep 2000,Swansea City v Bury,Swansea City,Bury,Bury,L,0-2,0,2,-,-,League Division 2,2000,2000,9,30,0,2
2727,14 Oct 2000,Swansea City v Stoke City,Swansea City,Stoke City,Stoke City,W,2-1,2,1,-,-,League Division 2,2000,2000,10,14,2,1
2728,17 Oct 2000,Swansea City v Swindon Town,Swansea City,Swindon Town,Swindon Town,D,0-0,0,0,-,-,League Division 2,2000,2000,10,17,0,0
2729,21 Oct 2000,Wrexham v Swansea City,Wrexham,Swansea City,Wrexham,L,1-0,1,0,-,-,League Division 2,2000,2000,10,21,0,1
2730,24 Oct 2000,Rotherham United v Swansea City,Rotherham United,Swansea City,Rotherham United,L,4-2,4,2,-,-,League Division 2,2000,2000,10,24,2,4
2731,28 Oct 2000,Swansea City v Port Vale,Swansea City,Port Vale,Port Vale,L,0-1,0,1,-,-,League Division 2,2000,2000,10,28,0,1
2732,31 Oct 2000,Swansea City v Bristol City,Swansea City,Bristol City,Bristol City,D,2-2,2,2,-,-,League Division 2,2000,2000,10,31,2,2
2733,04 Nov 2000,Oldham Athletic v Swansea City,Oldham Athletic,Swansea City,Oldham Athletic,D,1-1,1,1,-,-,League Division 2,2000,2000,11,4,1,1
2734,11 Nov 2000,Swansea City v Oxford United,Swansea City,Oxford United,Oxford United,L,1-2,1,2,-,-,League Division 2,2000,2000,11,11,1,2
2735,18 Nov 2000,AFC Bournemouth v Swansea City,AFC Bournemouth,Swansea City,AFC Bournemouth,L,2-0,2,0,-,-,FA Cup,2000,2000,11,18,0,2
2736,25 Nov 2000,Cambridge United v Swansea City,Cambridge United,Swansea City,Cambridge United,D,3-3,3,3,-,-,League Division 2,2000,2000,11,25,3,3
2737,02 Dec 2000,Swansea City v Bristol Rovers,Swansea City,Bristol Rovers,Bristol Rovers,D,0-0,0,0,-,-,League Division 2,2000,2000,12,2,0,0
2738,16 Dec 2000,AFC Bournemouth v Swansea City,AFC Bournemouth,Swansea City,AFC Bournemouth,L,2-0,2,0,-,-,League Division 2,2000,2000,12,16,0,2
2739,23 Dec 2000,Wycombe Wanderers v Swansea City,Wycombe Wanderers,Swansea City,Wycombe Wanderers,L,2-1,2,1,-,-,League Division 2,2000,2000,12,23,1,2
2740,26 Dec 2000,Swansea City v Walsall,Swansea City,Walsall,Walsall,W,3-1,3,1,-,-,League Division 2,2000,2000,12,26,3,1
2741,06 Jan 2001,Wigan Athletic v Swansea City,Wigan Athletic,Swansea City,Wigan Athletic,L,2-0,2,0,-,-,League Division 2,2000,2001,1,6,0,2
2742,09 Jan 2001,AFC Bournemouth v Swansea City,AFC Bournemouth,Swansea City,AFC Bournemouth,W,0-1,0,1,-,-,LDV Vans Trophy,2000,2001,1,9,1,0
2743,13 Jan 2001,Swansea City v Peterborough United,Swansea City,Peterborough United,Peterborough United,D,2-2,2,2,-,-,League Division 2,2000,2001,1,13,2,2
2744,20 Jan 2001,Walsall v Swansea City,Walsall,Swansea City,Walsall,L,5-1,5,1,-,-,League Division 2,2000,2001,1,20,1,5
2745,30 Jan 2001,Swansea City v Reading,Swansea City,Reading,Reading,W,1-0,1,0,-,-,LDV Vans Trophy,2000,2001,1,30,1,0
2746,03 Feb 2001,Bristol City v Swansea City,Bristol City,Swansea City,Bristol City,L,3-1,3,1,-,-,League Division 2,2000,2001,2,3,1,3
2747,11 Feb 2001,Swansea City v Millwall,Swansea City,Millwall,Millwall,D,0-0,0,0,-,-,League Division 2,2000,2001,2,11,0,0
2748,14 Feb 2001,Swansea City v Brentford,Swansea City,Brentford,Brentford,L,2-3,2,3,-,-,LDV Vans Trophy,2000,2001,2,14,2,3
2749,17 Feb 2001,Luton Town v Swansea City,Luton Town,Swansea City,Luton Town,L,5-3,5,3,-,-,League Division 2,2000,2001,2,17,3,5
2750,20 Feb 2001,Swansea City v Notts County,Swansea City,Notts County,Notts County,L,0-1,0,1,-,-,League Division 2,2000,2001,2,20,0,1
2751,24 Feb 2001,Swansea City v Reading,Swansea City,Reading,Reading,L,0-1,0,1,-,-,League Division 2,2000,2001,2,24,0,1
2752,27 Feb 2001,Northampton Town v Swansea City,Northampton Town,Swansea City,Northampton Town,L,2-1,2,1,-,-,League Division 2,2000,2001,2,27,1,2
2753,03 Mar 2001,Bury v Swansea City,Bury,Swansea City,Bury,L,3-0,3,0,-,-,League Division 2,2000,2001,3,3,0,3
2754,07 Mar 2001,Stoke City v Swansea City,Stoke City,Swansea City,Stoke City,W,1-2,1,2,-,-,League Division 2,2000,2001,3,7,2,1
2755,10 Mar 2001,Swansea City v Northampton Town,Swansea City,Northampton Town,Northampton Town,D,1-1,1,1,-,-,League Division 2,2000,2001,3,10,1,1
2756,17 Mar 2001,Swindon Town v Swansea City,Swindon Town,Swansea City,Swindon Town,D,1-1,1,1,-,-,League Division 2,2000,2001,3,17,1,1
2757,31 Mar 2001,Swansea City v AFC Bournemouth,Swansea City,AFC Bournemouth,AFC Bournemouth,L,0-3,0,3,-,-,League Division 2,2000,2001,3,31,0,3
2758,03 Apr 2001,Colchester United v Swansea City,Colchester United,Swansea City,Colchester United,L,3-0,3,0,-,-,League Division 2,2000,2001,4,3,0,3
2759,07 Apr 2001,Bristol Rovers v Swansea City,Bristol Rovers,Swansea City,Bristol Rovers,L,1-0,1,0,-,-,League Division 2,2000,2001,4,7,0,1
2760,10 Apr 2001,Swansea City v Wycombe Wanderers,Swansea City,Wycombe Wanderers,Wycombe Wanderers,W,3-1,3,1,-,-,League Division 2,2000,2001,4,10,3,1
2761,14 Apr 2001,Swansea City v Rotherham United,Swansea City,Rotherham United,Rotherham United,D,0-0,0,0,-,-,League Division 2,2000,2001,4,14,0,0
2762,16 Apr 2001,Port Vale v Swansea City,Port Vale,Swansea City,Port Vale,L,1-0,1,0,-,-,League Division 2,2000,2001,4,16,0,1
2763,21 Apr 2001,Swansea City v Oldham Athletic,Swansea City,Oldham Athletic,Oldham Athletic,L,1-2,1,2,-,-,League Division 2,2000,2001,4,21,1,2
2764,24 Apr 2001,Swansea City v Wrexham,Swansea City,Wrexham,Wrexham,L,0-1,0,1,-,-,League Division 2,2000,2001,4,24,0,1
2765,28 Apr 2001,Oxford United v Swansea City,Oxford United,Swansea City,Oxford United,L,3-1,3,1,-,-,League Division 2,2000,2001,4,28,1,3
2766,01 May 2001,Swansea City v Brentford,Swansea City,Brentford,Brentford,W,6-0,6,0,-,-,League Division 2,2000,2001,5,1,6,0
2767,05 May 2001,Swansea City v Cambridge United,Swansea City,Cambridge United,Cambridge United,D,1-1,1,1,-,-,League Division 2,2000,2001,5,5,1,1
2768,11 Aug 2001,Macclesfield Town v Swansea City,Macclesfield Town,Swansea City,Macclesfield Town,W,1-3,1,3,-,-,League Division 3,2001,2001,8,11,3,1
2769,18 Aug 2001,Swansea City v Oxford United,Swansea City,Oxford United,Oxford United,D,0-0,0,0,-,-,League Division 3,2001,2001,8,18,0,0
2770,21 Aug 2001,Swansea City v Peterborough United,Swansea City,Peterborough United,Peterborough United,L,0-2,0,2,-,-,League Cup,2001,2001,8,21,0,2
2771,25 Aug 2001,Lincoln City v Swansea City,Lincoln City,Swansea City,Lincoln City,L,3-0,3,0,-,-,League Division 3,2001,2001,8,25,0,3
2772,27 Aug 2001,Swansea City v Cheltenham Town,Swansea City,Cheltenham Town,Cheltenham Town,D,2-2,2,2,-,-,League Division 3,2001,2001,8,27,2,2
2773,08 Sep 2001,Swansea City v Exeter City,Swansea City,Exeter City,Exeter City,W,4-2,4,2,-,-,League Division 3,2001,2001,9,8,4,2
2774,11 Sep 2001,Plymouth Argyle v Swansea City,Plymouth Argyle,Swansea City,Plymouth Argyle,L,3-1,3,1,-,-,League Division 3,2001,2001,9,11,1,3
2775,15 Sep 2001,Swansea City v Halifax Town,Swansea City,Halifax Town,Halifax Town,L,0-2,0,2,-,-,League Division 3,2001,2001,9,15,0,2
2776,18 Sep 2001,Scunthorpe United v Swansea City,Scunthorpe United,Swansea City,Scunthorpe United,D,2-2,2,2,-,-,League Division 3,2001,2001,9,18,2,2
2777,22 Sep 2001,Hull City v Swansea City,Hull City,Swansea City,Hull City,L,2-1,2,1,-,-,League Division 3,2001,2001,9,22,1,2
2778,25 Sep 2001,Swansea City v Shrewsbury Town,Swansea City,Shrewsbury Town,Shrewsbury Town,D,3-3,3,3,-,-,League Division 3,2001,2001,9,25,3,3
2779,29 Sep 2001,Kidderminster Harriers v Swansea City,Kidderminster Harriers,Swansea City,Kidderminster Harriers,W,0-2,0,2,-,-,League Division 3,2001,2001,9,29,2,0
2780,09 Oct 2001,Swansea City v Rochdale,Swansea City,Rochdale,Rochdale,L,0-1,0,1,-,-,League Division 3,2001,2001,10,9,0,1
2781,13 Oct 2001,Southend United v Swansea City,Southend United,Swansea City,Southend United,L,4-2,4,2,-,-,League Division 3,2001,2001,10,13,2,4
2782,16 Oct 2001,Swansea City v Brighton and Hove Albion,Swansea City,Brighton and Hove Albion,Brighton and Hove Albion,L,1-2,1,2,-,-,LDV Vans Trophy,2001,2001,10,16,1,2
2783,20 Oct 2001,Swansea City v Leyton Orient,Swansea City,Leyton Orient,Leyton Orient,L,0-1,0,1,-,-,League Division 3,2001,2001,10,20,0,1
2784,23 Oct 2001,Swansea City v Darlington,Swansea City,Darlington,Darlington,W,2-0,2,0,-,-,League Division 3,2001,2001,10,23,2,0
2785,27 Oct 2001,Luton Town v Swansea City,Luton Town,Swansea City,Luton Town,L,3-0,3,0,-,-,League Division 3,2001,2001,10,27,0,3
